{
  "$schema": "https://json-schema.org/draft/2020-12/schema",
  "$id": "https://libero-max.org/schemas/manifest.schema.json",
  "title": "LIBERO-MAX Benchmark Manifest",
  "type": "object",
  "additionalProperties": false,
  "required": ["benchmark_id", "benchmark_version", "protocol", "cases"],
  "properties": {
    "benchmark_id": {"type": "string", "minLength": 1},
    "benchmark_version": {"type": "string", "minLength": 1},
    "protocol": {
      "type": "object",
      "additionalProperties": false,
      "required": ["arms", "query_interval", "scoring_track"],
      "properties": {
        "arms": {"const": ["control", "intervention"]},
        "query_interval": {"type": "integer", "minimum": 1},
        "scoring_track": {"enum": ["physical_completion", "intent_response"]},
        "substrate": {"type": "string", "minLength": 1},
        "profile": {"type": "string", "minLength": 1},
        "source_benchmark_commit": {"type": "string", "minLength": 1},
        "selection_contract": {"type": "string", "minLength": 1}
      }
    },
    "cases": {
      "type": "array",
      "minItems": 1,
      "items": {
        "type": "object",
        "additionalProperties": false,
        "required": [
          "case_id",
          "task_suite_name",
          "task_index",
          "init_state_index",
          "policy_seed",
          "timing_bucket",
          "scenario"
        ],
        "properties": {
          "case_id": {"type": "string", "minLength": 1},
          "task_suite_name": {
            "enum": ["libero_spatial", "libero_object", "libero_goal", "libero_10", "libero_90"]
          },
          "task_index": {"type": "integer", "minimum": 0},
          "init_state_index": {"type": "integer", "minimum": 0},
          "policy_seed": {"type": "integer", "minimum": 0},
          "timing_bucket": {"enum": ["early", "middle", "late"]},
          "task_name": {"type": "string", "minLength": 1},
          "substrate_category": {"type": "string", "minLength": 1},
          "substrate_difficulty": {
            "type": ["integer", "null"],
            "minimum": 1,
            "maximum": 5
          },
          "substrate_variant": {
            "type": "object",
            "additionalProperties": false,
            "required": [
              "benchmark",
              "category",
              "bddl_file",
              "init_states_file",
              "init_reference_bddl_file",
              "language",
              "source_revision"
            ],
            "properties": {
              "benchmark": {"const": "LIBERO-PRO"},
              "category": {"type": "string", "minLength": 1},
              "bddl_file": {
                "type": "string",
                "minLength": 6,
                "pattern": "^(?!/)(?!.*(?:^|/)\\.\\.(?:/|$)).*\\.bddl$"
              },
              "init_states_file": {
                "type": "string",
                "minLength": 13,
                "pattern": "^(?!/)(?!.*(?:^|/)\\.\\.(?:/|$)).*\\.pruned_init$"
              },
              "init_reference_bddl_file": {
                "type": "string",
                "minLength": 6,
                "pattern": "^(?!/)(?!.*(?:^|/)\\.\\.(?:/|$)).*\\.bddl$"
              },
              "language": {"type": "string", "minLength": 1},
              "source_revision": {"type": "string", "minLength": 1}
            }
          },
          "dynamic_phase": {"type": "string", "minLength": 1},
          "scenario": {"$ref": "scenario.schema.json"}
        }
      }
    }
  }
}
